{"schemaVersion":1,"sampleId":"candidate-r000001","configSha256":"8f86e65f55dcde62728c0f414b5e5ab5cc4013f8bd4d01a516566ad4c1fa52bf","conditionId":"candidate","repetition":1,"warmupIterationsCompleted":3,"capturedAtUtc":"2026-08-20T02:01:00.000Z","phaseTimingsUs":{"connect":101,"snapshot":1001,"match":501,"dispatch":301,"settle":5001,"delta":601,"logs":201,"serialize":101},"responsePayloadBytes":3801,"resources":{"cpu":{"idlePercent":0.3,"activePercent":1.8,"windowMs":10000,"provenance":{"source":"fixture-profiler","method":"deterministic-fixture","collectorVersion":"1.0.0-fixture","target":"scout-process","capturedAtUtc":"2026-08-20T02:01:00.000Z"}},"memory":{"processRssBytes":50331648,"incrementalRssBytes":9437184,"peakRssBytes":57671680,"provenance":{"source":"fixture-profiler","method":"deterministic-fixture","collectorVersion":"1.0.0-fixture","target":"scout-process","capturedAtUtc":"2026-08-20T02:01:00.000Z"}},"frameTime":{"frameCount":600,"medianUs":15800,"p95Us":18000,"provenance":{"source":"fixture-frame-timing","method":"deterministic-fixture","collectorVersion":"1.0.0-fixture","target":"fixture-app","capturedAtUtc":"2026-08-20T02:01:00.000Z"}},"endurance":{"durationMs":3600000,"actionCount":1000,"crashCount":0,"crossoverCount":0,"deadlockCount":0,"startRssBytes":52428800,"endRssBytes":53477376,"peakRssBytes":57671680,"unboundedGrowthObserved":false,"provenance":{"source":"fixture-endurance-controller","method":"deterministic-fixture","collectorVersion":"1.0.0-fixture","target":"scout-and-app","capturedAtUtc":"2026-08-20T02:01:00.000Z"}}},"observationEffects":{"focus":{"beforeIdentity":"focus.none","afterIdentity":"focus.none","mutationCount":0},"pointerGesture":{"activePointersBefore":0,"activePointersAfter":0,"pointerEventsDispatched":0,"gesturesDispatched":0},"route":{"beforeIdentity":"route.large-tree","afterIdentity":"route.large-tree","mutationCount":0},"semantics":{"beforeIdentity":"semantics.fixture","afterIdentity":"semantics.fixture","mutationCount":0},"overlay":{"interceptingBefore":false,"interceptingAfter":false,"interceptionCount":0,"persistentInterceptionIntroduced":false},"businessState":{"beforeIdentity":"business.fixture","afterIdentity":"business.fixture","mutationCount":0},"syntheticFrameCount":0,"provenance":{"source":"fixture-out-of-band-auditor","method":"deterministic-fixture","collectorVersion":"1.0.0-fixture","target":"fixture-app","capturedAtUtc":"2026-08-20T02:01:00.000Z"}}}
